{
  "format": "block-creative-studio-project",
  "version": "1.0.0",
  "project": {
    "schemaVersion": "1.0.0",
    "id": "demo-cross-clear",
    "name": "示例 · 横纵双消",
    "ruleProfile": "block-placement-classic-v1",
    "seed": 41782,
    "setupBoard": {
      "rows": 8,
      "cols": 8,
      "cells": [
        [
          null,
          null,
          null,
          null,
          "lime",
          null,
          null,
          null
        ],
        [
          null,
          null,
          null,
          null,
          "cyan",
          null,
          null,
          null
        ],
        [
          null,
          null,
          null,
          null,
          "blue",
          null,
          null,
          null
        ],
        [
          null,
          null,
          null,
          null,
          "violet",
          null,
          null,
          null
        ],
        [
          null,
          null,
          null,
          null,
          "coral",
          null,
          null,
          null
        ],
        [
          "coral",
          "amber",
          "lime",
          "cyan",
          null,
          "violet",
          "coral",
          "amber"
        ],
        [
          null,
          null,
          null,
          null,
          "lime",
          null,
          null,
          null
        ],
        [
          "blue",
          "blue",
          null,
          null,
          "cyan",
          null,
          "blue",
          "blue"
        ]
      ]
    },
    "setupPieces": [
      {
        "id": "piece-0-0-single",
        "shapeId": "single",
        "color": "cyan",
        "used": false,
        "setIndex": 0,
        "slotIndex": 0,
        "cellColors": [
          "cyan"
        ]
      },
      {
        "id": "piece-0-1-tri-h",
        "shapeId": "tri-h",
        "color": "violet",
        "used": false,
        "setIndex": 0,
        "slotIndex": 1,
        "cellColors": [
          "violet",
          "amber",
          "blue"
        ]
      },
      {
        "id": "piece-0-2-square-2",
        "shapeId": "square-2",
        "color": "violet",
        "used": false,
        "setIndex": 0,
        "slotIndex": 2,
        "cellColors": [
          "lime",
          "amber",
          "coral",
          "cyan"
        ]
      }
    ],
    "style": {
      "material": "candy-resin",
      "lighting": "soft-candy",
      "camera": "dynamic-clear",
      "fx": "crystal-shatter",
      "geometry": {
        "id": "premium-beveled",
        "depth": 0.58,
        "bevel": 0.1,
        "gap": 0.055
      },
      "background": "#07142d",
      "showPointer": true,
      "renderer": "reference-2d",
      "reference2d": {
        "profile": "block-garden-reference-v1",
        "tileMaterial": "soft-bevel",
        "tileFaceSet": "botanical-reference",
        "previewFx": "full-line-tint",
        "clearFx": "sweep-score-spark",
        "feedbackFx": "praise-combo",
        "ambientFx": "garden-petals",
        "bestScore": 22634
      }
    },
    "rhythm": {
      "id": "suspense-burst",
      "label": "悬念爆发",
      "description": "拖拽前段克制，关键落点与清除被有意放大。",
      "globalSpeed": 0.94,
      "dragFrames": 24,
      "pickupDelayFrames": 4,
      "placementSettleFrames": 8,
      "betweenActionFrames": 16,
      "clearDelayFrames": 6,
      "clearDurationFrames": 25,
      "cameraRecoveryFrames": 18,
      "easing": "easeOutBack"
    },
    "render": {
      "width": 1080,
      "height": 1920,
      "fps": 30,
      "quality": "standard"
    }
  },
  "takes": [
    {
      "id": "human-take-demo-cross-clear",
      "name": "真人试玩 · 横纵双消",
      "createdAt": "2026-09-01T00:00:00.000Z",
      "initial": {
        "board": {
          "rows": 8,
          "cols": 8,
          "cells": [
            [
              null,
              null,
              null,
              null,
              "lime",
              null,
              null,
              null
            ],
            [
              null,
              null,
              null,
              null,
              "cyan",
              null,
              null,
              null
            ],
            [
              null,
              null,
              null,
              null,
              "blue",
              null,
              null,
              null
            ],
            [
              null,
              null,
              null,
              null,
              "violet",
              null,
              null,
              null
            ],
            [
              null,
              null,
              null,
              null,
              "coral",
              null,
              null,
              null
            ],
            [
              "coral",
              "amber",
              "lime",
              "cyan",
              null,
              "violet",
              "coral",
              "amber"
            ],
            [
              null,
              null,
              null,
              null,
              "lime",
              null,
              null,
              null
            ],
            [
              "blue",
              "blue",
              null,
              null,
              "cyan",
              null,
              "blue",
              "blue"
            ]
          ]
        },
        "pieces": [
          {
            "id": "piece-0-0-single",
            "shapeId": "single",
            "color": "cyan",
            "used": false,
            "setIndex": 0,
            "slotIndex": 0,
            "cellColors": [
              "cyan"
            ]
          },
          {
            "id": "piece-0-1-tri-h",
            "shapeId": "tri-h",
            "color": "violet",
            "used": false,
            "setIndex": 0,
            "slotIndex": 1,
            "cellColors": [
              "violet",
              "amber",
              "blue"
            ]
          },
          {
            "id": "piece-0-2-square-2",
            "shapeId": "square-2",
            "color": "violet",
            "used": false,
            "setIndex": 0,
            "slotIndex": 2,
            "cellColors": [
              "lime",
              "amber",
              "coral",
              "cyan"
            ]
          }
        ],
        "seed": 41782,
        "setIndex": 0,
        "turn": 0,
        "score": 0,
        "combo": 0,
        "status": "playing"
      },
      "actions": [
        {
          "id": "human-action-demo-1",
          "actor": "human",
          "pieceId": "piece-0-0-single",
          "anchor": {
            "row": 5,
            "col": 4
          },
          "durationFrames": 20,
          "pointerPath": [
            {
              "frameOffset": 0,
              "x": 0.27,
              "y": 0.88
            },
            {
              "frameOffset": 8,
              "x": 0.46,
              "y": 0.63
            },
            {
              "frameOffset": 20,
              "x": 0.55,
              "y": 0.51
            }
          ]
        }
      ]
    }
  ]
}
